{
  "type": "array",
  "$schema": "http://json-schema.org/draft-04/schema#",
  "description": "",
  "minItems": 1,
  "uniqueItems": true,
  "items": {
    "type": "object",
    "required": [
      "scientificName",
      "guid",
      "rank",
      "rawRank"
    ],
    "properties": {
      "scientificName": {
        "type": "string",
        "minLength": 1
      },
      "guid": {
        "type": "string",
        "minLength": 1
      },
      "rank": {
        "type": "string",
        "minLength": 1
      },
      "rawRank": {
        "type": "string",
        "minLength": 1
      }
    }
  }
}